[
  {
    "scenario_id": "SYN-JAC104-001",
    "risk_level": "caution",
    "usage_guidance_status": "PARTIAL_STOP",
    "safe_actions": [
      "필터 교체 주기를 확인합니다.",
      "단수 중에는 원수 밸브를 잠그고 전원 플러그를 뽑습니다.",
      "연결 호스에 꺾인 부분이 있는지 확인합니다."
    ],
    "prohibited_actions": [
      "필터 교체 후에도 출수되지 않는 상태에서 원수 밸브와 전원을 켠 채 계속 사용하지 않습니다."
    ],
    "consultation_required": false,
    "generated_at": "2026-07-29T00:00:00+09:00",
    "inquiry_public_id": "f72a3b18-a4f8-5f5e-8c86-199ffc1d8aa2"
  },
  {
    "scenario_id": "SYN-JAC104-002",
    "risk_level": "general",
    "usage_guidance_status": "NORMAL",
    "safe_actions": [
      "조리수 또는 다른 수전의 동시 사용을 멈추고 출수합니다.",
      "필터 교체 주기를 확인하고 수명이 끝났으면 교체합니다.",
      "순간 온수와 설치 수압에 따른 정상 편차인지 확인합니다."
    ],
    "prohibited_actions": [
      "필터 수명이 끝난 상태에서 계속 사용하도록 안내하지 않습니다."
    ],
    "consultation_required": true,
    "generated_at": "2026-07-29T00:00:00+09:00",
    "inquiry_public_id": "bcb70ef6-01ac-5e0e-8a8d-fe5af43e8bde"
  },
  {
    "scenario_id": "SYN-JAC104-003",
    "risk_level": "general",
    "usage_guidance_status": "NORMAL",
    "safe_actions": [
      "연속 다량 출수 후에는 잠시 기다렸다가 다시 출수합니다.",
      "냉수 잠금 기능을 해제합니다.",
      "방열팬 먼지 필터를 확인하고 청소합니다."
    ],
    "prohibited_actions": [
      "2시간 뒤에도 차갑지 않은 상태를 정상으로 단정해 안내하지 않습니다."
    ],
    "consultation_required": false,
    "generated_at": "2026-07-29T00:00:00+09:00",
    "inquiry_public_id": "91a8cf0c-9139-5d17-a6bd-818eb9aa7585"
  },
  {
    "scenario_id": "SYN-JAC104-004",
    "risk_level": "danger",
    "usage_guidance_status": "TOTAL_STOP",
    "safe_actions": [
      "원수 밸브를 잠급니다.",
      "전원 플러그를 뽑습니다.",
      "고객상담센터에 연락합니다."
    ],
    "prohibited_actions": [
      "누수 상태에서 원수 밸브와 전원을 켠 채 제품을 사용하지 않습니다."
    ],
    "consultation_required": true,
    "generated_at": "2026-07-29T00:00:00+09:00",
    "inquiry_public_id": "8e2e2561-613b-5911-9318-b651f0787a90"
  },
  {
    "scenario_id": "SYN-JAC104-005",
    "risk_level": "caution",
    "usage_guidance_status": "PARTIAL_STOP",
    "safe_actions": [
      "10일 이내 부재 후 냉수, 정수, 온수를 각각 1L 이상 버립니다.",
      "부적합 장소 또는 장시간 미사용이면 필터를 모두 교체합니다."
    ],
    "prohibited_actions": [
      "장기 미사용 후 필요한 통수나 점검 없이 바로 음용하지 않습니다."
    ],
    "consultation_required": false,
    "generated_at": "2026-07-29T00:00:00+09:00",
    "inquiry_public_id": "40b6d3d1-8626-511c-92d3-982699a42f63"
  },
  {
    "scenario_id": "SYN-JAC104-006",
    "risk_level": "danger",
    "usage_guidance_status": "PENDING_CONSULTATION",
    "safe_actions": [
      "미지근한 온수는 두 번째 잔으로 확인하고 전원을 10초 뒤 재연결합니다.",
      "온수-1L 또는 120ml-출수 버튼으로 온도를 확인할 때 뜨거운 물에 주의합니다.",
      "온수가 나오지 않으면 온수 잠금 기능을 해제합니다.",
      "순간온수 모듈 점검 표시가 나오면 고객상담센터에 문의합니다."
    ],
    "prohibited_actions": [
      "LCD에 순간온수 모듈 점검 문구가 표시된 상태에서 출수된 물을 음용하지 않습니다."
    ],
    "consultation_required": true,
    "generated_at": "2026-07-29T00:00:00+09:00",
    "inquiry_public_id": "2b7d96e6-25a1-52eb-a8e2-9e52caf68b60"
  },
  {
    "scenario_id": "SYN-JAC104-007",
    "risk_level": "caution",
    "usage_guidance_status": "PARTIAL_STOP",
    "safe_actions": [
      "필터 교체 주기를 확인합니다.",
      "단수 중에는 원수 밸브를 잠그고 전원 플러그를 뽑습니다.",
      "연결 호스에 꺾인 부분이 있는지 확인합니다."
    ],
    "prohibited_actions": [
      "필터 교체 후에도 출수되지 않는 상태에서 원수 밸브와 전원을 켠 채 계속 사용하지 않습니다."
    ],
    "consultation_required": false,
    "generated_at": "2026-07-29T00:00:00+09:00",
    "inquiry_public_id": "3ebb394c-1a6f-5793-ac86-1f721350b820"
  },
  {
    "scenario_id": "SYN-JAC104-008",
    "risk_level": "caution",
    "usage_guidance_status": "PARTIAL_STOP",
    "safe_actions": [
      "필터 교체 주기를 확인합니다.",
      "단수 중에는 원수 밸브를 잠그고 전원 플러그를 뽑습니다.",
      "연결 호스에 꺾인 부분이 있는지 확인합니다."
    ],
    "prohibited_actions": [
      "필터 교체 후에도 출수되지 않는 상태에서 원수 밸브와 전원을 켠 채 계속 사용하지 않습니다."
    ],
    "consultation_required": true,
    "generated_at": "2026-07-29T00:00:00+09:00",
    "inquiry_public_id": "a6bdf6b7-b9ba-553a-8447-f928384c1ad1"
  },
  {
    "scenario_id": "SYN-JAC104-009",
    "risk_level": "general",
    "usage_guidance_status": "NORMAL",
    "safe_actions": [
      "조리수 또는 다른 수전의 동시 사용을 멈추고 출수합니다.",
      "필터 교체 주기를 확인하고 수명이 끝났으면 교체합니다.",
      "순간 온수와 설치 수압에 따른 정상 편차인지 확인합니다."
    ],
    "prohibited_actions": [
      "필터 수명이 끝난 상태에서 계속 사용하도록 안내하지 않습니다."
    ],
    "consultation_required": false,
    "generated_at": "2026-07-29T00:00:00+09:00",
    "inquiry_public_id": "88b76107-937a-5fca-ae51-1f21935b47db"
  },
  {
    "scenario_id": "SYN-JAC104-010",
    "risk_level": "general",
    "usage_guidance_status": "NORMAL",
    "safe_actions": [
      "조리수 또는 다른 수전의 동시 사용을 멈추고 출수합니다.",
      "필터 교체 주기를 확인하고 수명이 끝났으면 교체합니다.",
      "순간 온수와 설치 수압에 따른 정상 편차인지 확인합니다."
    ],
    "prohibited_actions": [
      "필터 수명이 끝난 상태에서 계속 사용하도록 안내하지 않습니다."
    ],
    "consultation_required": false,
    "generated_at": "2026-07-29T00:00:00+09:00",
    "inquiry_public_id": "f82886a1-8755-5dd1-b622-480a27a207af"
  },
  {
    "scenario_id": "SYN-JAC104-011",
    "risk_level": "general",
    "usage_guidance_status": "NORMAL",
    "safe_actions": [
      "연속 다량 출수 후에는 잠시 기다렸다가 다시 출수합니다.",
      "냉수 잠금 기능을 해제합니다.",
      "방열팬 먼지 필터를 확인하고 청소합니다."
    ],
    "prohibited_actions": [
      "2시간 뒤에도 차갑지 않은 상태를 정상으로 단정해 안내하지 않습니다."
    ],
    "consultation_required": false,
    "generated_at": "2026-07-29T00:00:00+09:00",
    "inquiry_public_id": "b987200b-656e-5dbc-837f-ee1e1cb3a93f"
  },
  {
    "scenario_id": "SYN-JAC104-013",
    "risk_level": "danger",
    "usage_guidance_status": "TOTAL_STOP",
    "safe_actions": [
      "원수 밸브를 잠급니다.",
      "전원 플러그를 뽑습니다.",
      "고객상담센터에 연락합니다."
    ],
    "prohibited_actions": [
      "누수 상태에서 원수 밸브와 전원을 켠 채 제품을 사용하지 않습니다."
    ],
    "consultation_required": true,
    "generated_at": "2026-07-29T00:00:00+09:00",
    "inquiry_public_id": "205850d3-763c-5256-9d39-82da21be0c31"
  },
  {
    "scenario_id": "SYN-JAC104-014",
    "risk_level": "danger",
    "usage_guidance_status": "TOTAL_STOP",
    "safe_actions": [
      "원수 밸브를 잠급니다.",
      "전원 플러그를 뽑습니다.",
      "고객상담센터에 연락합니다."
    ],
    "prohibited_actions": [
      "누수 상태에서 원수 밸브와 전원을 켠 채 제품을 사용하지 않습니다."
    ],
    "consultation_required": true,
    "generated_at": "2026-07-29T00:00:00+09:00",
    "inquiry_public_id": "60d83c53-efc8-5467-a13b-0f45f9ea9177"
  },
  {
    "scenario_id": "SYN-JAC104-015",
    "risk_level": "caution",
    "usage_guidance_status": "PARTIAL_STOP",
    "safe_actions": [
      "10일 이내 부재 후 냉수, 정수, 온수를 각각 1L 이상 버립니다.",
      "부적합 장소 또는 장시간 미사용이면 필터를 모두 교체합니다."
    ],
    "prohibited_actions": [
      "장기 미사용 후 필요한 통수나 점검 없이 바로 음용하지 않습니다."
    ],
    "consultation_required": false,
    "generated_at": "2026-07-29T00:00:00+09:00",
    "inquiry_public_id": "e9280a2d-fb61-55eb-a9a8-453f116e2b54"
  },
  {
    "scenario_id": "SYN-JAC104-017",
    "risk_level": "danger",
    "usage_guidance_status": "PENDING_CONSULTATION",
    "safe_actions": [
      "미지근한 온수는 두 번째 잔으로 확인하고 전원을 10초 뒤 재연결합니다.",
      "온수-1L 또는 120ml-출수 버튼으로 온도를 확인할 때 뜨거운 물에 주의합니다.",
      "온수가 나오지 않으면 온수 잠금 기능을 해제합니다.",
      "순간온수 모듈 점검 표시가 나오면 고객상담센터에 문의합니다."
    ],
    "prohibited_actions": [
      "LCD에 순간온수 모듈 점검 문구가 표시된 상태에서 출수된 물을 음용하지 않습니다."
    ],
    "consultation_required": true,
    "generated_at": "2026-07-29T00:00:00+09:00",
    "inquiry_public_id": "be4c7a29-fa4f-5e8f-bb9e-1dab0badf146"
  },
  {
    "scenario_id": "SYN-JAC104-018",
    "risk_level": "danger",
    "usage_guidance_status": "PENDING_CONSULTATION",
    "safe_actions": [
      "미지근한 온수는 두 번째 잔으로 확인하고 전원을 10초 뒤 재연결합니다.",
      "온수-1L 또는 120ml-출수 버튼으로 온도를 확인할 때 뜨거운 물에 주의합니다.",
      "온수가 나오지 않으면 온수 잠금 기능을 해제합니다.",
      "순간온수 모듈 점검 표시가 나오면 고객상담센터에 문의합니다."
    ],
    "prohibited_actions": [
      "LCD에 순간온수 모듈 점검 문구가 표시된 상태에서 출수된 물을 음용하지 않습니다."
    ],
    "consultation_required": true,
    "generated_at": "2026-07-29T00:00:00+09:00",
    "inquiry_public_id": "cd9adf11-fd61-57fd-956a-6dfac43fcb3d"
  },
  {
    "scenario_id": "SYN-JAC104-019",
    "risk_level": "general",
    "usage_guidance_status": "NORMAL",
    "safe_actions": [
      "윙, 툭, 냉장고 유사음, 내부 물 흐름 소리인지 구분합니다."
    ],
    "prohibited_actions": [
      "소리가 너무 큰데도 모든 소음을 정상 작동음으로 단정하지 않습니다."
    ],
    "consultation_required": false,
    "generated_at": "2026-07-29T00:00:00+09:00",
    "inquiry_public_id": "cca8204e-c447-515f-9606-7f78ea00dc6b"
  },
  {
    "scenario_id": "SYN-JAC104-020",
    "risk_level": "general",
    "usage_guidance_status": "NORMAL",
    "safe_actions": [
      "윙, 툭, 냉장고 유사음, 내부 물 흐름 소리인지 구분합니다."
    ],
    "prohibited_actions": [
      "소리가 너무 큰데도 모든 소음을 정상 작동음으로 단정하지 않습니다."
    ],
    "consultation_required": false,
    "generated_at": "2026-07-29T00:00:00+09:00",
    "inquiry_public_id": "7ae3ddf9-61d3-5b80-9a03-857bdabd81c6"
  },
  {
    "scenario_id": "SYN-JAC104-021",
    "risk_level": "general",
    "usage_guidance_status": "NORMAL",
    "safe_actions": [
      "윙, 툭, 냉장고 유사음, 내부 물 흐름 소리인지 구분합니다."
    ],
    "prohibited_actions": [
      "소리가 너무 큰데도 모든 소음을 정상 작동음으로 단정하지 않습니다."
    ],
    "consultation_required": true,
    "generated_at": "2026-07-29T00:00:00+09:00",
    "inquiry_public_id": "d8155085-e77d-5a61-a6e3-57a7d584487a"
  },
  {
    "scenario_id": "SYN-JAC104-022",
    "risk_level": "general",
    "usage_guidance_status": "PENDING_CONSULTATION",
    "safe_actions": [
      "검증된 공식 근거가 없음을 알리고 상담 연결을 제공합니다."
    ],
    "prohibited_actions": [
      "IoT 기능 지원 여부나 연결 방법을 추정하여 안내하지 않습니다."
    ],
    "consultation_required": true,
    "generated_at": "2026-07-29T00:00:00+09:00",
    "inquiry_public_id": "dcf13b8e-e15f-5fc3-b194-0a3af2f54985"
  },
  {
    "scenario_id": "SYN-JAC104-023",
    "risk_level": "general",
    "usage_guidance_status": "PENDING_CONSULTATION",
    "safe_actions": [
      "검증된 공식 근거가 없음을 알리고 상담 연결을 제공합니다."
    ],
    "prohibited_actions": [
      "IoT 기능 지원 여부나 연결 방법을 추정하여 안내하지 않습니다."
    ],
    "consultation_required": true,
    "generated_at": "2026-07-29T00:00:00+09:00",
    "inquiry_public_id": "2159fcea-b772-5bad-b6f3-6bfe444fb067"
  },